<?xml version="1.0"?>

<!--
 Hive Colony Framework
 Copyright (C) 2008 Hive Solutions Lda.

 This file is part of Hive Colony Framework.

 Hive Colony Framework is free software: you can redistribute it and/or modify
 it under the terms of the GNU General Public License as published by
 the Free Software Foundation, either version 3 of the License, or
 (at your option) any later version.

 Hive Colony Framework is distributed in the hope that it will be useful,
 but WITHOUT ANY WARRANTY; without even the implied warranty of
 MERCHANTABILITY or FITNESS FOR A PARTICULAR PURPOSE. See the
 GNU General Public License for more details.

 You should have received a copy of the GNU General Public License
 along with Hive Colony Framework. If not, see <http://www.gnu.org/licenses/>.
-->

<!-- 
 __author__    = SimÃ£o Rio <srio@hive.pt>
 __version__   = 1.0.0
 __revision__  = $LastChangedRevision: 72 $
 __date__      = $LastChangedDate: 2008-10-21 23:29:54 +0100 (ter, 21 Out 2008) $
 __copyright__ = Copyright (c) 2008 Hive Solutions Lda.
 __license__   = GNU General Public License (GPL), Version 3
-->

<input_configuration xsi:schemaLocation="http://www.hive.pt ../input_configuration.xsd" xmlns="http://www.hive.pt" xmlns:xsi="http://www.w3.org/2001/XMLSchema-instance">
	<tables>
		<table> <!-- lojas -->
			<name>lojas</name>
			<internal_entity>store</internal_entity>
			<primary_key>
				<primary_key_column>codigo</primary_key_column>
			</primary_key>			
			
			<columns>
				<column> <!-- codigo -->
					<name>codigo</name>
					<internal_attribute>id</internal_attribute>
				</column>
				
				<column> <!-- descricao -->
					<name>descricao</name>
					<internal_attribute>name</internal_attribute>
					<handlers>
						<handler>
							<name>column_handler_string_to_lowercase</name>
						</handler>
					</handlers>
				</column>
				
				<column> <!-- email -->
					<name>email</name>
					<internal_attribute>email</internal_attribute>
					<internal_entity>
						<id>0</id>
						<name>contact_information</name>
					</internal_entity>
					<handlers>
						<handler>
							<name>column_handler_string_to_lowercase</name>
						</handler>
					</handlers>
				</column>
				<column> <!-- telefone -->
					<name>telefone</name>
					<internal_attribute>phone_number</internal_attribute>
					<internal_entity>
						<id>0</id>
						<name>contact_information</name>
					</internal_entity>
				</column>
				<column> <!-- fax -->
					<name>fax</name>
					<internal_attribute>fax_number</internal_attribute>
					<internal_entity>
						<id>0</id>
						<name>contact_information</name>
					</internal_entity>
				</column>
				
				<column> <!-- morada -->
					<name>morada</name>
					<internal_attribute>name</internal_attribute>
					<internal_entity>
						<id>0</id>
						<name>address</name>
					</internal_entity>
					<handlers>
						<handler>
							<name>column_handler_string_to_lowercase</name>
						</handler>
					</handlers>
				</column>
				<column> <!-- local -->
					<name>local</name>
					<internal_attribute>zip_code_name</internal_attribute>
					<internal_entity>
						<id>0</id>
						<name>address</name>
					</internal_entity>
					<handlers>
						<handler>
							<name>column_handler_string_to_lowercase</name>
						</handler>
					</handlers>
				</column>
			</columns>
		</table>
	</tables>
</input_configuration>
